timestamp,commit,message,duration_s,input_tokens,output_tokens,cost_usd
2026-03-28T13:27:59Z,da31018,"Create User JPA entity with dependencies",64,771,2886,0.23916400000000002
2026-03-28T13:29:46Z,44df30a,"Create UserRepository with JPA integration tests",103,19,3967,0.35582225000000006
2026-03-28T13:30:51Z,68dea66,"Create UserService with CRUD methods",61,9,3192,0.21746900000000002
2026-03-28T13:34:04Z,6008929,"Create UserController with CRUD endpoints",190,27,6995,0.6514430000000001
2026-03-28T13:36:24Z,7408c35,"Add 404 exception handling for user not found",136,23,6553,0.5542942500000001
2026-03-28T13:38:36Z,58b2cc6,"Add 409 exception handling for duplicate name or email",128,15,7039,0.48088875
2026-03-28T13:40:09Z,578de46,"Add Spring Actuator with only health endpoint exposed",89,15,3412,0.33007325
